{"$schema":"https://json-schema.org/draft/2020-12/schema","title":"FreshnessReview","type":"object","required":["version","evaluation_fingerprint","reviewer","status","reviewed_revision","findings"],"properties":{"version":{"const":1},"evaluation_fingerprint":{"type":"string","pattern":"^[a-f0-9]{64}$"},"reviewer":{"type":"string","minLength":1},"status":{"enum":["approved","blocked","needs-changes"]},"reviewed_revision":{"type":"string","minLength":7},"findings":{"type":"array","items":{"type":"string"}}},"additionalProperties":false}