{
  "version": 1,
  "evaluation_fingerprint": "bbbbbbbbbbbbbbbbbbbbbbbbbbbbbbbbbbbbbbbbbbbbbbbbbbbbbbbbbbbbbbbb",
  "reviewer": "independent-verifier",
  "status": "approved",
  "reviewed_revision": "0123456789abcdef0123456789abcdef01234567",
  "findings": [
    "Example only: regenerate the evaluation fingerprint and bind this review to the exact current revision before use."
  ]
}